{
  "$schema": "https://json-schema.org/draft/2020-12/schema",
  "type": "object",
  "additionalProperties": false,
  "required": ["schema_version", "id", "fixture", "runtime", "steps", "cleanup"],
  "properties": {
    "schema_version": {"const": 2},
    "id": {"$ref": "#/$defs/id"},
    "fixture": {"$ref": "#/$defs/id"},
    "runtime": {
      "type": "object",
      "additionalProperties": false,
      "required": ["kind", "mod_id", "mod_version", "artifact_sha256"],
      "properties": {
        "kind": {"const": "prepared-packaged-client"},
        "mod_id": {"type": "string", "pattern": "^[a-z][a-z0-9_-]{1,63}$"},
        "mod_version": {"type": "string", "minLength": 1, "maxLength": 64},
        "artifact_sha256": {"$ref": "#/$defs/hash"}
      }
    },
    "limits": {
      "type": "object",
      "additionalProperties": false,
      "properties": {
        "wall_seconds": {"type": "integer", "minimum": 1, "maximum": 600},
        "max_steps": {"type": "integer", "minimum": 1, "maximum": 64},
        "max_keyframes": {"type": "integer", "minimum": 0, "maximum": 64}
      }
    },
    "steps": {
      "type": "array",
      "minItems": 1,
      "maxItems": 64,
      "items": {"$ref": "#/$defs/step"}
    },
    "cleanup": {"enum": ["release-control", "save-exit"]}
  },
  "$defs": {
    "id": {"type": "string", "pattern": "^[a-z0-9][a-z0-9-]{0,63}$"},
    "hash": {"type": "string", "pattern": "^[0-9a-f]{64}$"},
    "registry_id": {"type": "string", "pattern": "^[a-z0-9_.-]+:[a-z0-9_./-]+$", "maxLength": 128},
    "step": {
      "type": "object",
      "additionalProperties": false,
      "required": ["id"],
      "properties": {
        "id": {"$ref": "#/$defs/id"},
        "observe": {
          "type": "array",
          "minItems": 1,
          "maxItems": 8,
          "uniqueItems": true,
          "items": {
            "oneOf": [
              {"enum": ["world", "player", "screen", "frame", "inventory", "nearby_entities", "aura_node", "aura_pump", "storage", "hud_render"]},
              {"$ref": "#/$defs/typed_observation"}
            ]
          }
        },
        "action": {"$ref": "#/$defs/action"},
        "wait": {"$ref": "#/$defs/wait"},
        "require": {"$ref": "#/$defs/require"}
      },
      "oneOf": [
        {"required": ["observe"]},
        {"required": ["action"]},
        {"required": ["wait"]},
        {"required": ["require"]}
      ]
    },
    "typed_observation": {
      "oneOf": [
        {
          "type": "object",
          "additionalProperties": false,
          "required": ["type"],
          "properties": {"type": {"const": "server_tick"}}
        },
        {
          "type": "object",
          "additionalProperties": false,
          "required": ["type"],
          "properties": {"type": {"const": "player_inventory"}}
        },
        {
          "type": "object",
          "additionalProperties": false,
          "required": ["type", "x", "y", "z"],
          "properties": {
            "type": {"const": "aura_block"},
            "x": {"$ref": "#/$defs/x"},
            "y": {"$ref": "#/$defs/y"},
            "z": {"$ref": "#/$defs/x"}
          }
        },
        {
          "type": "object",
          "additionalProperties": false,
          "required": ["type", "x", "y", "z"],
          "properties": {
            "type": {"const": "aura_block_server"},
            "x": {"$ref": "#/$defs/x"},
            "y": {"$ref": "#/$defs/y"},
            "z": {"$ref": "#/$defs/x"}
          }
        }
      ]
    },
    "action": {
      "oneOf": [
        {
          "type": "object", "additionalProperties": false,
          "required": ["type", "key"],
          "properties": {"type": {"const": "press_key"}, "key": {"enum": ["Enter", "Escape", "E", "Tab"]}}
        },
        {
          "type": "object", "additionalProperties": false,
          "required": ["type", "x", "y"],
          "properties": {"type": {"const": "click"}, "x": {"type": "integer", "minimum": 0, "maximum": 8191}, "y": {"type": "integer", "minimum": 0, "maximum": 8191}}
        },
        {
          "type": "object", "additionalProperties": false,
          "required": ["type", "index"],
          "properties": {"type": {"const": "click_button_index"}, "index": {"type": "integer", "minimum": 0, "maximum": 20}}
        },
        {
          "type": "object", "additionalProperties": false,
          "required": ["type"],
          "properties": {"type": {"const": "use_item"}}
        },
        {
          "type": "object", "additionalProperties": false,
          "required": ["type", "slot", "item"],
          "properties": {"type": {"const": "select_hotbar"}, "slot": {"type": "integer", "minimum": 0, "maximum": 8}, "item": {"$ref": "#/$defs/registry_id"}}
        },
        {
          "type": "object", "additionalProperties": false,
          "required": ["type", "count"],
          "properties": {"type": {"const": "drop_selected"}, "count": {"type": "integer", "minimum": 1, "maximum": 64}}
        },
        {"$ref": "#/$defs/block_action"}
      ]
    },
    "block_action": {
      "oneOf": [
        {
          "type": "object", "additionalProperties": false,
          "required": ["type", "x", "y", "z", "block_id"],
          "properties": {
            "type": {"const": "aim_at_block"},
            "x": {"$ref": "#/$defs/x"}, "y": {"$ref": "#/$defs/y"}, "z": {"$ref": "#/$defs/x"},
            "block_id": {"$ref": "#/$defs/registry_id"}
          }
        },
        {
          "type": "object", "additionalProperties": false,
          "required": ["type", "x", "y", "z", "block_id"],
          "properties": {
            "type": {"const": "use_item_at_block"},
            "x": {"$ref": "#/$defs/x"}, "y": {"$ref": "#/$defs/y"}, "z": {"$ref": "#/$defs/x"},
            "block_id": {"$ref": "#/$defs/registry_id"}
          }
        }
      ]
    },
    "wait": {
      "type": "object", "additionalProperties": false,
      "required": ["type", "count"],
      "properties": {"type": {"const": "ticks"}, "count": {"type": "integer", "minimum": 1, "maximum": 1200}}
    },
    "require": {
      "oneOf": [
        {
          "type": "object", "additionalProperties": false,
          "required": ["type", "equals"],
          "properties": {"type": {"const": "screen_class"}, "equals": {"type": "string", "minLength": 1, "maxLength": 160}}
        },
        {
          "type": "object", "additionalProperties": false,
          "required": ["type", "equals"],
          "properties": {"type": {"const": "world_name"}, "equals": {"type": "string", "minLength": 1, "maxLength": 160}}
        },
        {
          "type": "object", "additionalProperties": false,
          "required": ["type", "before", "after", "metric", "color", "minimum_delta"],
          "properties": {
            "type": {"const": "aura_increase"}, "before": {"$ref": "#/$defs/id"}, "after": {"$ref": "#/$defs/id"},
            "metric": {"const": "aura_by_color"}, "color": {"$ref": "#/$defs/color"},
            "minimum_delta": {"type": "integer", "minimum": 1, "maximum": 1000000}
          }
        },
        {
          "type": "object", "additionalProperties": false,
          "required": ["type", "before", "after", "metric", "minimum_delta"],
          "properties": {
            "type": {"const": "aura_increase"}, "before": {"$ref": "#/$defs/id"}, "after": {"$ref": "#/$defs/id"},
            "metric": {"enum": ["total_aura", "stored_power", "power", "speed"]},
            "minimum_delta": {"type": "integer", "minimum": 1, "maximum": 1000000}
          }
        },
        {
          "type": "object", "additionalProperties": false,
          "required": ["type", "before", "after", "item_id", "expected_count_delta"],
          "properties": {
            "type": {"const": "inventory_conservation"}, "before": {"$ref": "#/$defs/id"}, "after": {"$ref": "#/$defs/id"},
            "item_id": {"$ref": "#/$defs/registry_id"},
            "expected_count_delta": {"type": "integer", "minimum": -64, "maximum": 64}
          }
        }
      ]
    },
    "color": {"enum": ["white", "orange", "magenta", "light_blue", "yellow", "lime", "pink", "gray", "light_gray", "cyan", "purple", "blue", "brown", "green", "red", "black"]},
    "x": {"type": "integer", "minimum": -30000000, "maximum": 30000000},
    "y": {"type": "integer", "minimum": -64, "maximum": 319}
  }
}
